{
  "schemaVersion": "2.0.0",
  "songId": "376",
  "durationSeconds": 245.333333,
  "segments": [
    {
      "index": 0,
      "startSeconds": 0.0,
      "endSeconds": 0.9287981859410431,
      "label": "N"
    },
    {
      "index": 1,
      "startSeconds": 0.9287981859410431,
      "endSeconds": 8.359183673469389,
      "label": "E:min"
    },
    {
      "index": 2,
      "startSeconds": 8.359183673469389,
      "endSeconds": 48.94766439909297,
      "label": "E:maj"
    },
    {
      "index": 3,
      "startSeconds": 48.94766439909297,
      "endSeconds": 51.68761904761905,
      "label": "E:7"
    },
    {
      "index": 4,
      "startSeconds": 51.68761904761905,
      "endSeconds": 55.635011337868484,
      "label": "E:maj"
    },
    {
      "index": 5,
      "startSeconds": 55.635011337868484,
      "endSeconds": 65.43383219954649,
      "label": "F#:maj"
    },
    {
      "index": 6,
      "startSeconds": 65.43383219954649,
      "endSeconds": 67.45396825396826,
      "label": "B:maj"
    },
    {
      "index": 7,
      "startSeconds": 67.45396825396826,
      "endSeconds": 71.37814058956916,
      "label": "E:min"
    },
    {
      "index": 8,
      "startSeconds": 71.37814058956916,
      "endSeconds": 74.44317460317461,
      "label": "A:min"
    },
    {
      "index": 9,
      "startSeconds": 74.44317460317461,
      "endSeconds": 75.30231292517007,
      "label": "A:min/b7"
    },
    {
      "index": 10,
      "startSeconds": 75.30231292517007,
      "endSeconds": 79.27292517006804,
      "label": "F#:dim"
    },
    {
      "index": 11,
      "startSeconds": 79.27292517006804,
      "endSeconds": 83.22031746031746,
      "label": "B:maj"
    },
    {
      "index": 12,
      "startSeconds": 83.22031746031746,
      "endSeconds": 87.09804988662131,
      "label": "E:min"
    },
    {
      "index": 13,
      "startSeconds": 87.09804988662131,
      "endSeconds": 90.4649433106576,
      "label": "A:min"
    },
    {
      "index": 14,
      "startSeconds": 90.4649433106576,
      "endSeconds": 91.04544217687075,
      "label": "B:maj"
    },
    {
      "index": 15,
      "startSeconds": 91.04544217687075,
      "endSeconds": 93.042358276644,
      "label": "F#:min"
    },
    {
      "index": 16,
      "startSeconds": 93.042358276644,
      "endSeconds": 95.06249433106576,
      "label": "B:maj"
    },
    {
      "index": 17,
      "startSeconds": 95.06249433106576,
      "endSeconds": 118.60752834467121,
      "label": "E:maj"
    },
    {
      "index": 18,
      "startSeconds": 118.60752834467121,
      "endSeconds": 126.68807256235829,
      "label": "F#:maj"
    },
    {
      "index": 19,
      "startSeconds": 126.68807256235829,
      "endSeconds": 129.3583673469388,
      "label": "F#:min"
    },
    {
      "index": 20,
      "startSeconds": 129.3583673469388,
      "endSeconds": 130.40326530612245,
      "label": "B:maj"
    },
    {
      "index": 21,
      "startSeconds": 130.40326530612245,
      "endSeconds": 134.32743764172335,
      "label": "E:min"
    },
    {
      "index": 22,
      "startSeconds": 134.32743764172335,
      "endSeconds": 137.41569160997733,
      "label": "A:min"
    },
    {
      "index": 23,
      "startSeconds": 137.41569160997733,
      "endSeconds": 138.25160997732428,
      "label": "A:min/b7"
    },
    {
      "index": 24,
      "startSeconds": 138.25160997732428,
      "endSeconds": 142.22222222222223,
      "label": "F#:dim"
    },
    {
      "index": 25,
      "startSeconds": 142.22222222222223,
      "endSeconds": 146.14639455782313,
      "label": "B:maj"
    },
    {
      "index": 26,
      "startSeconds": 146.14639455782313,
      "endSeconds": 150.07056689342403,
      "label": "E:min"
    },
    {
      "index": 27,
      "startSeconds": 150.07056689342403,
      "endSeconds": 154.041179138322,
      "label": "A:min"
    },
    {
      "index": 28,
      "startSeconds": 154.041179138322,
      "endSeconds": 155.9916553287982,
      "label": "F#:dim"
    },
    {
      "index": 29,
      "startSeconds": 155.9916553287982,
      "endSeconds": 157.91891156462586,
      "label": "B:maj"
    },
    {
      "index": 30,
      "startSeconds": 157.91891156462586,
      "endSeconds": 161.91274376417235,
      "label": "C:maj7"
    },
    {
      "index": 31,
      "startSeconds": 161.91274376417235,
      "endSeconds": 165.83691609977325,
      "label": "B:sus4(b7)"
    },
    {
      "index": 32,
      "startSeconds": 165.83691609977325,
      "endSeconds": 169.73786848072564,
      "label": "Bb:maj"
    },
    {
      "index": 33,
      "startSeconds": 169.73786848072564,
      "endSeconds": 173.59238095238095,
      "label": "A:7"
    },
    {
      "index": 34,
      "startSeconds": 173.59238095238095,
      "endSeconds": 180.02430839002267,
      "label": "D:maj"
    },
    {
      "index": 35,
      "startSeconds": 180.02430839002267,
      "endSeconds": 181.53360544217688,
      "label": "A:maj"
    },
    {
      "index": 36,
      "startSeconds": 181.53360544217688,
      "endSeconds": 185.41133786848073,
      "label": "Bb:maj"
    },
    {
      "index": 37,
      "startSeconds": 185.41133786848073,
      "endSeconds": 189.54448979591837,
      "label": "A:maj"
    },
    {
      "index": 38,
      "startSeconds": 189.54448979591837,
      "endSeconds": 193.42222222222222,
      "label": "D:min"
    },
    {
      "index": 39,
      "startSeconds": 193.42222222222222,
      "endSeconds": 197.4857142857143,
      "label": "G:min7"
    },
    {
      "index": 40,
      "startSeconds": 197.4857142857143,
      "endSeconds": 202.59410430839003,
      "label": "A:maj"
    },
    {
      "index": 41,
      "startSeconds": 202.59410430839003,
      "endSeconds": 204.21950113378685,
      "label": "E:min"
    },
    {
      "index": 42,
      "startSeconds": 204.21950113378685,
      "endSeconds": 205.63591836734693,
      "label": "B:maj"
    },
    {
      "index": 43,
      "startSeconds": 205.63591836734693,
      "endSeconds": 209.0724716553288,
      "label": "E:min"
    },
    {
      "index": 44,
      "startSeconds": 209.0724716553288,
      "endSeconds": 212.23038548752834,
      "label": "A:min"
    },
    {
      "index": 45,
      "startSeconds": 212.23038548752834,
      "endSeconds": 213.01986394557824,
      "label": "A:min/b7"
    },
    {
      "index": 46,
      "startSeconds": 213.01986394557824,
      "endSeconds": 216.9904761904762,
      "label": "F#:dim"
    },
    {
      "index": 47,
      "startSeconds": 216.9904761904762,
      "endSeconds": 220.91464852607712,
      "label": "B:maj"
    },
    {
      "index": 48,
      "startSeconds": 220.91464852607712,
      "endSeconds": 224.81560090702948,
      "label": "E:min"
    },
    {
      "index": 49,
      "startSeconds": 224.81560090702948,
      "endSeconds": 228.73977324263038,
      "label": "A:min"
    },
    {
      "index": 50,
      "startSeconds": 228.73977324263038,
      "endSeconds": 230.78312925170067,
      "label": "F#:min"
    },
    {
      "index": 51,
      "startSeconds": 230.78312925170067,
      "endSeconds": 232.78004535147392,
      "label": "B:maj"
    },
    {
      "index": 52,
      "startSeconds": 232.78004535147392,
      "endSeconds": 242.2770068027211,
      "label": "E:maj"
    },
    {
      "index": 53,
      "startSeconds": 242.2770068027211,
      "endSeconds": 245.333333,
      "label": "N"
    }
  ]
}
