{
  "schemaVersion": "2.0.0",
  "songId": "893",
  "durationSeconds": 192.41,
  "segments": [
    {
      "index": 0,
      "startSeconds": 0.0,
      "endSeconds": 0.023219954648526078,
      "label": "N"
    },
    {
      "index": 1,
      "startSeconds": 0.023219954648526078,
      "endSeconds": 5.712108843537415,
      "label": "C:min"
    },
    {
      "index": 2,
      "startSeconds": 5.712108843537415,
      "endSeconds": 10.24,
      "label": "Ab:maj"
    },
    {
      "index": 3,
      "startSeconds": 10.24,
      "endSeconds": 11.354557823129252,
      "label": "Bb:maj"
    },
    {
      "index": 4,
      "startSeconds": 11.354557823129252,
      "endSeconds": 17.020226757369613,
      "label": "C:min"
    },
    {
      "index": 5,
      "startSeconds": 17.020226757369613,
      "endSeconds": 21.594557823129254,
      "label": "Ab:maj"
    },
    {
      "index": 6,
      "startSeconds": 21.594557823129254,
      "endSeconds": 23.637913832199548,
      "label": "Bb:maj"
    },
    {
      "index": 7,
      "startSeconds": 23.637913832199548,
      "endSeconds": 26.470748299319727,
      "label": "Eb:maj"
    },
    {
      "index": 8,
      "startSeconds": 26.470748299319727,
      "endSeconds": 28.444444444444446,
      "label": "N"
    },
    {
      "index": 9,
      "startSeconds": 28.444444444444446,
      "endSeconds": 33.97079365079365,
      "label": "Ab:maj"
    },
    {
      "index": 10,
      "startSeconds": 33.97079365079365,
      "endSeconds": 39.59002267573696,
      "label": "C:min7"
    },
    {
      "index": 11,
      "startSeconds": 39.59002267573696,
      "endSeconds": 44.419773242630384,
      "label": "Ab:maj"
    },
    {
      "index": 12,
      "startSeconds": 44.419773242630384,
      "endSeconds": 45.34857142857143,
      "label": "Bb:maj"
    },
    {
      "index": 13,
      "startSeconds": 45.34857142857143,
      "endSeconds": 50.89814058956916,
      "label": "C:min"
    },
    {
      "index": 14,
      "startSeconds": 50.89814058956916,
      "endSeconds": 55.51891156462585,
      "label": "Ab:maj"
    },
    {
      "index": 15,
      "startSeconds": 55.51891156462585,
      "endSeconds": 59.350204081632654,
      "label": "Bb:maj"
    },
    {
      "index": 16,
      "startSeconds": 59.350204081632654,
      "endSeconds": 65.03909297052154,
      "label": "C:min"
    },
    {
      "index": 17,
      "startSeconds": 65.03909297052154,
      "endSeconds": 69.59020408163265,
      "label": "Ab:maj"
    },
    {
      "index": 18,
      "startSeconds": 69.59020408163265,
      "endSeconds": 70.68154195011338,
      "label": "Bb:maj"
    },
    {
      "index": 19,
      "startSeconds": 70.68154195011338,
      "endSeconds": 76.34721088435374,
      "label": "C:min"
    },
    {
      "index": 20,
      "startSeconds": 76.34721088435374,
      "endSeconds": 80.87510204081633,
      "label": "Ab:maj"
    },
    {
      "index": 21,
      "startSeconds": 80.87510204081633,
      "endSeconds": 82.47727891156462,
      "label": "Bb:maj"
    },
    {
      "index": 22,
      "startSeconds": 82.47727891156462,
      "endSeconds": 83.15065759637189,
      "label": "C:min/5"
    },
    {
      "index": 23,
      "startSeconds": 83.15065759637189,
      "endSeconds": 87.00517006802721,
      "label": "Ab:maj"
    },
    {
      "index": 24,
      "startSeconds": 87.00517006802721,
      "endSeconds": 87.60888888888888,
      "label": "Bb:maj"
    },
    {
      "index": 25,
      "startSeconds": 87.60888888888888,
      "endSeconds": 88.74666666666667,
      "label": "C:min"
    },
    {
      "index": 26,
      "startSeconds": 88.74666666666667,
      "endSeconds": 90.4649433106576,
      "label": "Ab:maj"
    },
    {
      "index": 27,
      "startSeconds": 90.4649433106576,
      "endSeconds": 92.02068027210885,
      "label": "F:min"
    },
    {
      "index": 28,
      "startSeconds": 92.02068027210885,
      "endSeconds": 93.25133786848073,
      "label": "C:min/5"
    },
    {
      "index": 29,
      "startSeconds": 93.25133786848073,
      "endSeconds": 94.50521541950114,
      "label": "C:min"
    },
    {
      "index": 30,
      "startSeconds": 94.50521541950114,
      "endSeconds": 98.35972789115647,
      "label": "Ab:maj"
    },
    {
      "index": 31,
      "startSeconds": 98.35972789115647,
      "endSeconds": 98.94022675736962,
      "label": "Bb:maj"
    },
    {
      "index": 32,
      "startSeconds": 98.94022675736962,
      "endSeconds": 100.00834467120181,
      "label": "C:min"
    },
    {
      "index": 33,
      "startSeconds": 100.00834467120181,
      "endSeconds": 101.81950113378684,
      "label": "Ab:maj"
    },
    {
      "index": 34,
      "startSeconds": 101.81950113378684,
      "endSeconds": 103.16625850340137,
      "label": "F:min"
    },
    {
      "index": 35,
      "startSeconds": 103.16625850340137,
      "endSeconds": 105.13995464852609,
      "label": "G:min"
    },
    {
      "index": 36,
      "startSeconds": 105.13995464852609,
      "endSeconds": 128.54566893424035,
      "label": "N"
    },
    {
      "index": 37,
      "startSeconds": 128.54566893424035,
      "endSeconds": 134.1881179138322,
      "label": "C:min"
    },
    {
      "index": 38,
      "startSeconds": 134.1881179138322,
      "endSeconds": 138.8088888888889,
      "label": "Ab:maj"
    },
    {
      "index": 39,
      "startSeconds": 138.8088888888889,
      "endSeconds": 142.22222222222223,
      "label": "Bb:maj"
    },
    {
      "index": 40,
      "startSeconds": 142.22222222222223,
      "endSeconds": 145.42657596371882,
      "label": "N"
    },
    {
      "index": 41,
      "startSeconds": 145.42657596371882,
      "endSeconds": 151.13868480725623,
      "label": "C:min"
    },
    {
      "index": 42,
      "startSeconds": 151.13868480725623,
      "endSeconds": 155.71301587301588,
      "label": "Ab:maj"
    },
    {
      "index": 43,
      "startSeconds": 155.71301587301588,
      "endSeconds": 156.78113378684807,
      "label": "Bb:maj"
    },
    {
      "index": 44,
      "startSeconds": 156.78113378684807,
      "endSeconds": 162.47002267573697,
      "label": "C:min"
    },
    {
      "index": 45,
      "startSeconds": 162.47002267573697,
      "endSeconds": 166.99791383219954,
      "label": "Ab:maj"
    },
    {
      "index": 46,
      "startSeconds": 166.99791383219954,
      "endSeconds": 168.20535147392292,
      "label": "Bb:maj"
    },
    {
      "index": 47,
      "startSeconds": 168.20535147392292,
      "endSeconds": 173.7317006802721,
      "label": "C:min"
    },
    {
      "index": 48,
      "startSeconds": 173.7317006802721,
      "endSeconds": 178.30603174603175,
      "label": "Ab:maj"
    },
    {
      "index": 49,
      "startSeconds": 178.30603174603175,
      "endSeconds": 179.37414965986395,
      "label": "Bb:maj"
    },
    {
      "index": 50,
      "startSeconds": 179.37414965986395,
      "endSeconds": 185.0398185941043,
      "label": "C:min"
    },
    {
      "index": 51,
      "startSeconds": 185.0398185941043,
      "endSeconds": 189.86956916099774,
      "label": "Ab:maj"
    },
    {
      "index": 52,
      "startSeconds": 189.86956916099774,
      "endSeconds": 192.41,
      "label": "N"
    }
  ]
}
