{
  "schemaVersion": "2.0.0",
  "songId": "536",
  "durationSeconds": 94.406531,
  "segments": [
    {
      "index": 0,
      "startSeconds": 0.0,
      "endSeconds": 1.509297052154195,
      "label": "N"
    },
    {
      "index": 1,
      "startSeconds": 1.509297052154195,
      "endSeconds": 6.710566893424036,
      "label": "C:maj"
    },
    {
      "index": 2,
      "startSeconds": 6.710566893424036,
      "endSeconds": 7.894784580498866,
      "label": "A:min"
    },
    {
      "index": 3,
      "startSeconds": 7.894784580498866,
      "endSeconds": 9.125442176870749,
      "label": "C:maj"
    },
    {
      "index": 4,
      "startSeconds": 9.125442176870749,
      "endSeconds": 11.609977324263038,
      "label": "F:maj7"
    },
    {
      "index": 5,
      "startSeconds": 11.609977324263038,
      "endSeconds": 13.003174603174603,
      "label": "E:min7"
    },
    {
      "index": 6,
      "startSeconds": 13.003174603174603,
      "endSeconds": 14.187392290249434,
      "label": "A:7"
    },
    {
      "index": 7,
      "startSeconds": 14.187392290249434,
      "endSeconds": 16.091428571428573,
      "label": "D:min7"
    },
    {
      "index": 8,
      "startSeconds": 16.091428571428573,
      "endSeconds": 17.066666666666666,
      "label": "G:maj"
    },
    {
      "index": 9,
      "startSeconds": 17.066666666666666,
      "endSeconds": 17.972244897959182,
      "label": "C:maj"
    },
    {
      "index": 10,
      "startSeconds": 17.972244897959182,
      "endSeconds": 19.040362811791383,
      "label": "A:min/b3"
    },
    {
      "index": 11,
      "startSeconds": 19.040362811791383,
      "endSeconds": 22.175056689342405,
      "label": "D:min7"
    },
    {
      "index": 12,
      "startSeconds": 22.175056689342405,
      "endSeconds": 27.00480725623583,
      "label": "C:maj"
    },
    {
      "index": 13,
      "startSeconds": 27.00480725623583,
      "endSeconds": 27.654965986394558,
      "label": "G:maj/3"
    },
    {
      "index": 14,
      "startSeconds": 27.654965986394558,
      "endSeconds": 29.1178231292517,
      "label": "A:min"
    },
    {
      "index": 15,
      "startSeconds": 29.1178231292517,
      "endSeconds": 30.06984126984127,
      "label": "A:min/b7"
    },
    {
      "index": 16,
      "startSeconds": 30.06984126984127,
      "endSeconds": 31.509478458049887,
      "label": "F#:hdim7"
    },
    {
      "index": 17,
      "startSeconds": 31.509478458049887,
      "endSeconds": 32.60081632653061,
      "label": "B:7"
    },
    {
      "index": 18,
      "startSeconds": 32.60081632653061,
      "endSeconds": 33.97079365079365,
      "label": "E:min7"
    },
    {
      "index": 19,
      "startSeconds": 33.97079365079365,
      "endSeconds": 35.15501133786848,
      "label": "A:min7"
    },
    {
      "index": 20,
      "startSeconds": 35.15501133786848,
      "endSeconds": 36.339229024943315,
      "label": "D:min7"
    },
    {
      "index": 21,
      "startSeconds": 36.339229024943315,
      "endSeconds": 37.151927437641724,
      "label": "G:7"
    },
    {
      "index": 22,
      "startSeconds": 37.151927437641724,
      "endSeconds": 37.63954648526077,
      "label": "Ab:hdim7"
    },
    {
      "index": 23,
      "startSeconds": 37.63954648526077,
      "endSeconds": 39.10240362811791,
      "label": "A:min7"
    },
    {
      "index": 24,
      "startSeconds": 39.10240362811791,
      "endSeconds": 40.170521541950116,
      "label": "A:min/b7"
    },
    {
      "index": 25,
      "startSeconds": 40.170521541950116,
      "endSeconds": 41.40117913832199,
      "label": "D:min7"
    },
    {
      "index": 26,
      "startSeconds": 41.40117913832199,
      "endSeconds": 42.91047619047619,
      "label": "G:7"
    },
    {
      "index": 27,
      "startSeconds": 42.91047619047619,
      "endSeconds": 46.13804988662132,
      "label": "F:maj"
    },
    {
      "index": 28,
      "startSeconds": 46.13804988662132,
      "endSeconds": 48.36716553287982,
      "label": "C:maj/3"
    },
    {
      "index": 29,
      "startSeconds": 48.36716553287982,
      "endSeconds": 49.83002267573696,
      "label": "F:maj7"
    },
    {
      "index": 30,
      "startSeconds": 49.83002267573696,
      "endSeconds": 50.89814058956916,
      "label": "F:maj"
    },
    {
      "index": 31,
      "startSeconds": 50.89814058956916,
      "endSeconds": 53.47555555555556,
      "label": "C:maj/3"
    },
    {
      "index": 32,
      "startSeconds": 53.47555555555556,
      "endSeconds": 54.659773242630386,
      "label": "F:maj7"
    },
    {
      "index": 33,
      "startSeconds": 54.659773242630386,
      "endSeconds": 55.797551020408164,
      "label": "F:maj"
    },
    {
      "index": 34,
      "startSeconds": 55.797551020408164,
      "endSeconds": 57.26040816326531,
      "label": "E:7"
    },
    {
      "index": 35,
      "startSeconds": 57.26040816326531,
      "endSeconds": 59.55918367346939,
      "label": "A:min7"
    },
    {
      "index": 36,
      "startSeconds": 59.55918367346939,
      "endSeconds": 60.836281179138325,
      "label": "B:7"
    },
    {
      "index": 37,
      "startSeconds": 60.836281179138325,
      "endSeconds": 63.69233560090703,
      "label": "E:maj"
    },
    {
      "index": 38,
      "startSeconds": 63.69233560090703,
      "endSeconds": 66.61804988662132,
      "label": "F:maj7"
    },
    {
      "index": 39,
      "startSeconds": 66.61804988662132,
      "endSeconds": 67.61650793650794,
      "label": "E:min"
    },
    {
      "index": 40,
      "startSeconds": 67.61650793650794,
      "endSeconds": 68.89360544217688,
      "label": "A:min7"
    },
    {
      "index": 41,
      "startSeconds": 68.89360544217688,
      "endSeconds": 70.14748299319729,
      "label": "D:min7"
    },
    {
      "index": 42,
      "startSeconds": 70.14748299319729,
      "endSeconds": 71.37814058956916,
      "label": "G:sus4(b7)"
    },
    {
      "index": 43,
      "startSeconds": 71.37814058956916,
      "endSeconds": 73.95555555555556,
      "label": "C:maj"
    },
    {
      "index": 44,
      "startSeconds": 73.95555555555556,
      "endSeconds": 76.71873015873015,
      "label": "F:maj7"
    },
    {
      "index": 45,
      "startSeconds": 76.71873015873015,
      "endSeconds": 77.83328798185941,
      "label": "C:maj/3"
    },
    {
      "index": 46,
      "startSeconds": 77.83328798185941,
      "endSeconds": 79.13360544217687,
      "label": "A:min7"
    },
    {
      "index": 47,
      "startSeconds": 79.13360544217687,
      "endSeconds": 80.55002267573697,
      "label": "D:min7"
    },
    {
      "index": 48,
      "startSeconds": 80.55002267573697,
      "endSeconds": 82.361179138322,
      "label": "G:7"
    },
    {
      "index": 49,
      "startSeconds": 82.361179138322,
      "endSeconds": 90.16308390022675,
      "label": "C:maj"
    },
    {
      "index": 50,
      "startSeconds": 90.16308390022675,
      "endSeconds": 94.406531,
      "label": "N"
    }
  ]
}
