{
  "schemaVersion": "2.0.0",
  "songId": "520",
  "durationSeconds": 93.466122,
  "segments": [
    {
      "index": 0,
      "startSeconds": 0.0,
      "endSeconds": 2.066575963718821,
      "label": "N"
    },
    {
      "index": 1,
      "startSeconds": 2.066575963718821,
      "endSeconds": 9.032562358276644,
      "label": "G:maj"
    },
    {
      "index": 2,
      "startSeconds": 9.032562358276644,
      "endSeconds": 11.331337868480725,
      "label": "C:maj"
    },
    {
      "index": 3,
      "startSeconds": 11.331337868480725,
      "endSeconds": 13.722993197278912,
      "label": "G:maj"
    },
    {
      "index": 4,
      "startSeconds": 13.722993197278912,
      "endSeconds": 15.139410430839003,
      "label": "C:maj"
    },
    {
      "index": 5,
      "startSeconds": 15.139410430839003,
      "endSeconds": 15.603809523809524,
      "label": "Eb:maj"
    },
    {
      "index": 6,
      "startSeconds": 15.603809523809524,
      "endSeconds": 16.04498866213152,
      "label": "F:maj"
    },
    {
      "index": 7,
      "startSeconds": 16.04498866213152,
      "endSeconds": 17.531065759637187,
      "label": "G:maj"
    },
    {
      "index": 8,
      "startSeconds": 17.531065759637187,
      "endSeconds": 18.36698412698413,
      "label": "F:maj/2"
    },
    {
      "index": 9,
      "startSeconds": 18.36698412698413,
      "endSeconds": 19.365442176870747,
      "label": "C:maj/3"
    },
    {
      "index": 10,
      "startSeconds": 19.365442176870747,
      "endSeconds": 20.712199546485262,
      "label": "Eb:maj"
    },
    {
      "index": 11,
      "startSeconds": 20.712199546485262,
      "endSeconds": 21.71065759637188,
      "label": "D:maj"
    },
    {
      "index": 12,
      "startSeconds": 21.71065759637188,
      "endSeconds": 22.151836734693877,
      "label": "E:min"
    },
    {
      "index": 13,
      "startSeconds": 22.151836734693877,
      "endSeconds": 23.870113378684806,
      "label": "A:maj"
    },
    {
      "index": 14,
      "startSeconds": 23.870113378684806,
      "endSeconds": 27.678185941043086,
      "label": "G:maj"
    },
    {
      "index": 15,
      "startSeconds": 27.678185941043086,
      "endSeconds": 29.23392290249433,
      "label": "C:maj"
    },
    {
      "index": 16,
      "startSeconds": 29.23392290249433,
      "endSeconds": 29.976961451247167,
      "label": "C:maj/2"
    },
    {
      "index": 17,
      "startSeconds": 29.976961451247167,
      "endSeconds": 32.345396825396826,
      "label": "G:maj"
    },
    {
      "index": 18,
      "startSeconds": 32.345396825396826,
      "endSeconds": 33.36707482993197,
      "label": "C:maj"
    },
    {
      "index": 19,
      "startSeconds": 33.36707482993197,
      "endSeconds": 33.8314739229025,
      "label": "D:maj"
    },
    {
      "index": 20,
      "startSeconds": 33.8314739229025,
      "endSeconds": 34.22621315192744,
      "label": "Eb:maj"
    },
    {
      "index": 21,
      "startSeconds": 34.22621315192744,
      "endSeconds": 34.69061224489796,
      "label": "F:maj"
    },
    {
      "index": 22,
      "startSeconds": 34.69061224489796,
      "endSeconds": 36.13024943310658,
      "label": "G:maj"
    },
    {
      "index": 23,
      "startSeconds": 36.13024943310658,
      "endSeconds": 37.05904761904762,
      "label": "F:maj"
    },
    {
      "index": 24,
      "startSeconds": 37.05904761904762,
      "endSeconds": 37.987845804988666,
      "label": "C:maj/3"
    },
    {
      "index": 25,
      "startSeconds": 37.987845804988666,
      "endSeconds": 39.3578231292517,
      "label": "Eb:maj"
    },
    {
      "index": 26,
      "startSeconds": 39.3578231292517,
      "endSeconds": 40.35628117913832,
      "label": "D:maj"
    },
    {
      "index": 27,
      "startSeconds": 40.35628117913832,
      "endSeconds": 40.72780045351474,
      "label": "E:min"
    },
    {
      "index": 28,
      "startSeconds": 40.72780045351474,
      "endSeconds": 42.63183673469388,
      "label": "A:min"
    },
    {
      "index": 29,
      "startSeconds": 42.63183673469388,
      "endSeconds": 43.97859410430839,
      "label": "G:maj"
    },
    {
      "index": 30,
      "startSeconds": 43.97859410430839,
      "endSeconds": 46.32380952380952,
      "label": "F:maj"
    },
    {
      "index": 31,
      "startSeconds": 46.32380952380952,
      "endSeconds": 48.645804988662135,
      "label": "G:maj"
    },
    {
      "index": 32,
      "startSeconds": 48.645804988662135,
      "endSeconds": 50.944580498866216,
      "label": "F:maj"
    },
    {
      "index": 33,
      "startSeconds": 50.944580498866216,
      "endSeconds": 53.47555555555556,
      "label": "G:maj"
    },
    {
      "index": 34,
      "startSeconds": 53.47555555555556,
      "endSeconds": 54.56689342403628,
      "label": "E:min"
    },
    {
      "index": 35,
      "startSeconds": 54.56689342403628,
      "endSeconds": 55.65823129251701,
      "label": "B:min"
    },
    {
      "index": 36,
      "startSeconds": 55.65823129251701,
      "endSeconds": 56.65668934240363,
      "label": "C:maj"
    },
    {
      "index": 37,
      "startSeconds": 56.65668934240363,
      "endSeconds": 57.980226757369614,
      "label": "G:maj"
    },
    {
      "index": 38,
      "startSeconds": 57.980226757369614,
      "endSeconds": 60.51120181405896,
      "label": "F:maj"
    },
    {
      "index": 39,
      "startSeconds": 60.51120181405896,
      "endSeconds": 62.60099773242631,
      "label": "D:maj"
    },
    {
      "index": 40,
      "startSeconds": 62.60099773242631,
      "endSeconds": 64.94621315192744,
      "label": "G:maj"
    },
    {
      "index": 41,
      "startSeconds": 64.94621315192744,
      "endSeconds": 67.221768707483,
      "label": "C:maj"
    },
    {
      "index": 42,
      "startSeconds": 67.221768707483,
      "endSeconds": 69.63664399092971,
      "label": "G:maj"
    },
    {
      "index": 43,
      "startSeconds": 69.63664399092971,
      "endSeconds": 71.88897959183673,
      "label": "C:maj"
    },
    {
      "index": 44,
      "startSeconds": 71.88897959183673,
      "endSeconds": 74.28063492063492,
      "label": "G:maj"
    },
    {
      "index": 45,
      "startSeconds": 74.28063492063492,
      "endSeconds": 75.16299319727891,
      "label": "C:maj"
    },
    {
      "index": 46,
      "startSeconds": 75.16299319727891,
      "endSeconds": 76.99736961451248,
      "label": "Eb:maj"
    },
    {
      "index": 47,
      "startSeconds": 76.99736961451248,
      "endSeconds": 77.71718820861678,
      "label": "G:maj/5"
    },
    {
      "index": 48,
      "startSeconds": 77.71718820861678,
      "endSeconds": 78.5298866213152,
      "label": "B:maj/3"
    },
    {
      "index": 49,
      "startSeconds": 78.5298866213152,
      "endSeconds": 79.99274376417233,
      "label": "E:min"
    },
    {
      "index": 50,
      "startSeconds": 79.99274376417233,
      "endSeconds": 83.66149659863946,
      "label": "A:7"
    },
    {
      "index": 51,
      "startSeconds": 83.66149659863946,
      "endSeconds": 86.33179138321995,
      "label": "A:min7"
    },
    {
      "index": 52,
      "startSeconds": 86.33179138321995,
      "endSeconds": 86.98195011337869,
      "label": "D:maj"
    },
    {
      "index": 53,
      "startSeconds": 86.98195011337869,
      "endSeconds": 90.07020408163265,
      "label": "G:maj"
    },
    {
      "index": 54,
      "startSeconds": 90.07020408163265,
      "endSeconds": 93.466122,
      "label": "N"
    }
  ]
}
