{
  "schemaVersion": "2.0.0",
  "songId": "911",
  "durationSeconds": 168.35,
  "segments": [
    {
      "index": 0,
      "startSeconds": 0.0,
      "endSeconds": 9.682721088435374,
      "label": "N"
    },
    {
      "index": 1,
      "startSeconds": 9.682721088435374,
      "endSeconds": 19.644081632653062,
      "label": "C#:min"
    },
    {
      "index": 2,
      "startSeconds": 19.644081632653062,
      "endSeconds": 20.805079365079365,
      "label": "A:maj"
    },
    {
      "index": 3,
      "startSeconds": 20.805079365079365,
      "endSeconds": 21.84997732426304,
      "label": "Ab:maj"
    },
    {
      "index": 4,
      "startSeconds": 21.84997732426304,
      "endSeconds": 23.777233560090703,
      "label": "C#:min/5"
    },
    {
      "index": 5,
      "startSeconds": 23.777233560090703,
      "endSeconds": 25.58839002267574,
      "label": "Ab:maj"
    },
    {
      "index": 6,
      "startSeconds": 25.58839002267574,
      "endSeconds": 34.73705215419501,
      "label": "C#:min"
    },
    {
      "index": 7,
      "startSeconds": 34.73705215419501,
      "endSeconds": 36.08380952380953,
      "label": "A:maj"
    },
    {
      "index": 8,
      "startSeconds": 36.08380952380953,
      "endSeconds": 41.65659863945578,
      "label": "C#:min/5"
    },
    {
      "index": 9,
      "startSeconds": 41.65659863945578,
      "endSeconds": 49.08698412698413,
      "label": "C#:min"
    },
    {
      "index": 10,
      "startSeconds": 49.08698412698413,
      "endSeconds": 53.63809523809524,
      "label": "N"
    },
    {
      "index": 11,
      "startSeconds": 53.63809523809524,
      "endSeconds": 55.68145124716553,
      "label": "C#:min"
    },
    {
      "index": 12,
      "startSeconds": 55.68145124716553,
      "endSeconds": 56.65668934240363,
      "label": "A:maj"
    },
    {
      "index": 13,
      "startSeconds": 56.65668934240363,
      "endSeconds": 57.65514739229025,
      "label": "Ab:maj"
    },
    {
      "index": 14,
      "startSeconds": 57.65514739229025,
      "endSeconds": 59.7449433106576,
      "label": "C#:min"
    },
    {
      "index": 15,
      "startSeconds": 59.7449433106576,
      "endSeconds": 60.65052154195011,
      "label": "A:maj"
    },
    {
      "index": 16,
      "startSeconds": 60.65052154195011,
      "endSeconds": 63.669115646258504,
      "label": "C#:min"
    },
    {
      "index": 17,
      "startSeconds": 63.669115646258504,
      "endSeconds": 64.66757369614513,
      "label": "A:maj"
    },
    {
      "index": 18,
      "startSeconds": 64.66757369614513,
      "endSeconds": 65.68925170068027,
      "label": "Ab:maj"
    },
    {
      "index": 19,
      "startSeconds": 65.68925170068027,
      "endSeconds": 71.72643990929706,
      "label": "C#:min"
    },
    {
      "index": 20,
      "startSeconds": 71.72643990929706,
      "endSeconds": 72.70167800453515,
      "label": "A:maj"
    },
    {
      "index": 21,
      "startSeconds": 72.70167800453515,
      "endSeconds": 73.63047619047619,
      "label": "Ab:maj"
    },
    {
      "index": 22,
      "startSeconds": 73.63047619047619,
      "endSeconds": 79.66766439909297,
      "label": "C#:min"
    },
    {
      "index": 23,
      "startSeconds": 79.66766439909297,
      "endSeconds": 80.66612244897959,
      "label": "A:maj"
    },
    {
      "index": 24,
      "startSeconds": 80.66612244897959,
      "endSeconds": 81.66458049886621,
      "label": "Ab:maj"
    },
    {
      "index": 25,
      "startSeconds": 81.66458049886621,
      "endSeconds": 111.43256235827664,
      "label": "C#:min"
    },
    {
      "index": 26,
      "startSeconds": 111.43256235827664,
      "endSeconds": 115.42639455782313,
      "label": "N"
    },
    {
      "index": 27,
      "startSeconds": 115.42639455782313,
      "endSeconds": 125.73605442176871,
      "label": "C#:min"
    },
    {
      "index": 28,
      "startSeconds": 125.73605442176871,
      "endSeconds": 126.64163265306122,
      "label": "A:maj"
    },
    {
      "index": 29,
      "startSeconds": 126.64163265306122,
      "endSeconds": 127.70975056689343,
      "label": "Ab:maj"
    },
    {
      "index": 30,
      "startSeconds": 127.70975056689343,
      "endSeconds": 133.67727891156463,
      "label": "C#:min"
    },
    {
      "index": 31,
      "startSeconds": 133.67727891156463,
      "endSeconds": 134.69895691609977,
      "label": "A:maj"
    },
    {
      "index": 32,
      "startSeconds": 134.69895691609977,
      "endSeconds": 135.60453514739228,
      "label": "Ab:maj"
    },
    {
      "index": 33,
      "startSeconds": 135.60453514739228,
      "endSeconds": 141.68816326530612,
      "label": "C#:min"
    },
    {
      "index": 34,
      "startSeconds": 141.68816326530612,
      "endSeconds": 142.6634013605442,
      "label": "A:maj"
    },
    {
      "index": 35,
      "startSeconds": 142.6634013605442,
      "endSeconds": 143.6386394557823,
      "label": "Ab:maj"
    },
    {
      "index": 36,
      "startSeconds": 143.6386394557823,
      "endSeconds": 149.74548752834468,
      "label": "C#:min"
    },
    {
      "index": 37,
      "startSeconds": 149.74548752834468,
      "endSeconds": 150.62784580498865,
      "label": "A:maj"
    },
    {
      "index": 38,
      "startSeconds": 150.62784580498865,
      "endSeconds": 151.6495238095238,
      "label": "Ab:maj"
    },
    {
      "index": 39,
      "startSeconds": 151.6495238095238,
      "endSeconds": 153.64643990929704,
      "label": "C#:min"
    },
    {
      "index": 40,
      "startSeconds": 153.64643990929704,
      "endSeconds": 155.6433560090703,
      "label": "Ab:maj"
    },
    {
      "index": 41,
      "startSeconds": 155.6433560090703,
      "endSeconds": 157.29197278911565,
      "label": "C#:min"
    },
    {
      "index": 42,
      "startSeconds": 157.29197278911565,
      "endSeconds": 168.35,
      "label": "N"
    }
  ]
}
