{
  "schemaVersion": "2.0.0",
  "songId": "306",
  "durationSeconds": 266.146667,
  "segments": [
    {
      "index": 0,
      "startSeconds": 0.0,
      "endSeconds": 2.1362358276643993,
      "label": "N"
    },
    {
      "index": 1,
      "startSeconds": 2.1362358276643993,
      "endSeconds": 16.34684807256236,
      "label": "Ab:min"
    },
    {
      "index": 2,
      "startSeconds": 16.34684807256236,
      "endSeconds": 19.202902494331067,
      "label": "E:maj"
    },
    {
      "index": 3,
      "startSeconds": 19.202902494331067,
      "endSeconds": 22.918095238095237,
      "label": "F#:maj"
    },
    {
      "index": 4,
      "startSeconds": 22.918095238095237,
      "endSeconds": 26.842267573696144,
      "label": "Ab:min"
    },
    {
      "index": 5,
      "startSeconds": 26.842267573696144,
      "endSeconds": 27.608526077097505,
      "label": "F#:maj/3"
    },
    {
      "index": 6,
      "startSeconds": 27.608526077097505,
      "endSeconds": 29.489342403628118,
      "label": "B:maj"
    },
    {
      "index": 7,
      "startSeconds": 29.489342403628118,
      "endSeconds": 32.949115646258505,
      "label": "E:maj"
    },
    {
      "index": 8,
      "startSeconds": 32.949115646258505,
      "endSeconds": 36.501768707482995,
      "label": "F#:maj"
    },
    {
      "index": 9,
      "startSeconds": 36.501768707482995,
      "endSeconds": 40.72780045351474,
      "label": "Ab:min"
    },
    {
      "index": 10,
      "startSeconds": 40.72780045351474,
      "endSeconds": 41.23863945578231,
      "label": "F#:maj/3"
    },
    {
      "index": 11,
      "startSeconds": 41.23863945578231,
      "endSeconds": 42.887256235827664,
      "label": "B:maj"
    },
    {
      "index": 12,
      "startSeconds": 42.887256235827664,
      "endSeconds": 54.96163265306122,
      "label": "Ab:min"
    },
    {
      "index": 13,
      "startSeconds": 54.96163265306122,
      "endSeconds": 56.98176870748299,
      "label": "N"
    },
    {
      "index": 14,
      "startSeconds": 56.98176870748299,
      "endSeconds": 60.3718820861678,
      "label": "E:maj"
    },
    {
      "index": 15,
      "startSeconds": 60.3718820861678,
      "endSeconds": 63.80843537414966,
      "label": "F#:maj"
    },
    {
      "index": 16,
      "startSeconds": 63.80843537414966,
      "endSeconds": 68.54530612244898,
      "label": "Ab:min"
    },
    {
      "index": 17,
      "startSeconds": 68.54530612244898,
      "endSeconds": 70.72798185941043,
      "label": "B:maj"
    },
    {
      "index": 18,
      "startSeconds": 70.72798185941043,
      "endSeconds": 74.11809523809524,
      "label": "E:maj"
    },
    {
      "index": 19,
      "startSeconds": 74.11809523809524,
      "endSeconds": 77.53142857142858,
      "label": "F#:maj"
    },
    {
      "index": 20,
      "startSeconds": 77.53142857142858,
      "endSeconds": 84.33487528344672,
      "label": "Ab:min"
    },
    {
      "index": 21,
      "startSeconds": 84.33487528344672,
      "endSeconds": 87.81786848072562,
      "label": "E:maj"
    },
    {
      "index": 22,
      "startSeconds": 87.81786848072562,
      "endSeconds": 91.23120181405896,
      "label": "F#:maj"
    },
    {
      "index": 23,
      "startSeconds": 91.23120181405896,
      "endSeconds": 95.92163265306122,
      "label": "Ab:min"
    },
    {
      "index": 24,
      "startSeconds": 95.92163265306122,
      "endSeconds": 97.22195011337868,
      "label": "B:maj"
    },
    {
      "index": 25,
      "startSeconds": 97.22195011337868,
      "endSeconds": 98.31328798185942,
      "label": "Ab:min"
    },
    {
      "index": 26,
      "startSeconds": 98.31328798185942,
      "endSeconds": 101.49442176870748,
      "label": "E:maj"
    },
    {
      "index": 27,
      "startSeconds": 101.49442176870748,
      "endSeconds": 104.95419501133787,
      "label": "F#:maj"
    },
    {
      "index": 28,
      "startSeconds": 104.95419501133787,
      "endSeconds": 109.69106575963718,
      "label": "Ab:min"
    },
    {
      "index": 29,
      "startSeconds": 109.69106575963718,
      "endSeconds": 113.01151927437643,
      "label": "B:maj"
    },
    {
      "index": 30,
      "startSeconds": 113.01151927437643,
      "endSeconds": 127.29179138321996,
      "label": "Ab:min"
    },
    {
      "index": 31,
      "startSeconds": 127.29179138321996,
      "endSeconds": 130.68190476190478,
      "label": "E:maj"
    },
    {
      "index": 32,
      "startSeconds": 130.68190476190478,
      "endSeconds": 134.14167800453515,
      "label": "F#:maj"
    },
    {
      "index": 33,
      "startSeconds": 134.14167800453515,
      "endSeconds": 138.41414965986394,
      "label": "Ab:min"
    },
    {
      "index": 34,
      "startSeconds": 138.41414965986394,
      "endSeconds": 138.97142857142856,
      "label": "F#:maj/3"
    },
    {
      "index": 35,
      "startSeconds": 138.97142857142856,
      "endSeconds": 141.01478458049885,
      "label": "B:maj"
    },
    {
      "index": 36,
      "startSeconds": 141.01478458049885,
      "endSeconds": 144.4281179138322,
      "label": "E:maj"
    },
    {
      "index": 37,
      "startSeconds": 144.4281179138322,
      "endSeconds": 147.93433106575964,
      "label": "F#:maj"
    },
    {
      "index": 38,
      "startSeconds": 147.93433106575964,
      "endSeconds": 152.55510204081634,
      "label": "Ab:min"
    },
    {
      "index": 39,
      "startSeconds": 152.55510204081634,
      "endSeconds": 155.50403628117914,
      "label": "B:maj"
    },
    {
      "index": 40,
      "startSeconds": 155.50403628117914,
      "endSeconds": 156.54893424036283,
      "label": "E:maj"
    },
    {
      "index": 41,
      "startSeconds": 156.54893424036283,
      "endSeconds": 161.77342403628117,
      "label": "N"
    },
    {
      "index": 42,
      "startSeconds": 161.77342403628117,
      "endSeconds": 168.39111111111112,
      "label": "Ab:min"
    },
    {
      "index": 43,
      "startSeconds": 168.39111111111112,
      "endSeconds": 171.9437641723356,
      "label": "E:maj"
    },
    {
      "index": 44,
      "startSeconds": 171.9437641723356,
      "endSeconds": 176.88961451247167,
      "label": "F#:maj"
    },
    {
      "index": 45,
      "startSeconds": 176.88961451247167,
      "endSeconds": 180.00108843537416,
      "label": "Ab:min"
    },
    {
      "index": 46,
      "startSeconds": 180.00108843537416,
      "endSeconds": 182.0908843537415,
      "label": "B:maj"
    },
    {
      "index": 47,
      "startSeconds": 182.0908843537415,
      "endSeconds": 185.52743764172337,
      "label": "E:maj"
    },
    {
      "index": 48,
      "startSeconds": 185.52743764172337,
      "endSeconds": 188.91755102040815,
      "label": "F#:maj"
    },
    {
      "index": 49,
      "startSeconds": 188.91755102040815,
      "endSeconds": 193.6544217687075,
      "label": "Ab:min"
    },
    {
      "index": 50,
      "startSeconds": 193.6544217687075,
      "endSeconds": 195.7906575963719,
      "label": "B:maj"
    },
    {
      "index": 51,
      "startSeconds": 195.7906575963719,
      "endSeconds": 199.22721088435375,
      "label": "E:maj"
    },
    {
      "index": 52,
      "startSeconds": 199.22721088435375,
      "endSeconds": 202.68698412698413,
      "label": "F#:maj"
    },
    {
      "index": 53,
      "startSeconds": 202.68698412698413,
      "endSeconds": 207.40063492063493,
      "label": "Ab:min"
    },
    {
      "index": 54,
      "startSeconds": 207.40063492063493,
      "endSeconds": 209.5136507936508,
      "label": "B:maj"
    },
    {
      "index": 55,
      "startSeconds": 209.5136507936508,
      "endSeconds": 214.29696145124717,
      "label": "Ab:min"
    },
    {
      "index": 56,
      "startSeconds": 214.29696145124717,
      "endSeconds": 216.15455782312927,
      "label": "B:maj"
    },
    {
      "index": 57,
      "startSeconds": 216.15455782312927,
      "endSeconds": 218.03537414965987,
      "label": "Ab:min/b3"
    },
    {
      "index": 58,
      "startSeconds": 218.03537414965987,
      "endSeconds": 221.5415873015873,
      "label": "E:maj"
    },
    {
      "index": 59,
      "startSeconds": 221.5415873015873,
      "endSeconds": 224.95492063492063,
      "label": "F#:maj"
    },
    {
      "index": 60,
      "startSeconds": 224.95492063492063,
      "endSeconds": 229.66857142857143,
      "label": "Ab:min"
    },
    {
      "index": 61,
      "startSeconds": 229.66857142857143,
      "endSeconds": 230.92244897959185,
      "label": "B:maj"
    },
    {
      "index": 62,
      "startSeconds": 230.92244897959185,
      "endSeconds": 232.1298866213152,
      "label": "Ab:min"
    },
    {
      "index": 63,
      "startSeconds": 232.1298866213152,
      "endSeconds": 235.21814058956917,
      "label": "E:maj"
    },
    {
      "index": 64,
      "startSeconds": 235.21814058956917,
      "endSeconds": 238.67791383219955,
      "label": "F#:maj"
    },
    {
      "index": 65,
      "startSeconds": 238.67791383219955,
      "endSeconds": 243.3683446712018,
      "label": "Ab:min"
    },
    {
      "index": 66,
      "startSeconds": 243.3683446712018,
      "endSeconds": 244.76154195011338,
      "label": "B:maj"
    },
    {
      "index": 67,
      "startSeconds": 244.76154195011338,
      "endSeconds": 266.146667,
      "label": "N"
    }
  ]
}
