{
  "schemaVersion": "2.0.0",
  "songId": "531",
  "durationSeconds": 121.103673,
  "segments": [
    {
      "index": 0,
      "startSeconds": 0.0,
      "endSeconds": 4.899410430839002,
      "label": "N"
    },
    {
      "index": 1,
      "startSeconds": 4.899410430839002,
      "endSeconds": 7.128526077097506,
      "label": "F:7"
    },
    {
      "index": 2,
      "startSeconds": 7.128526077097506,
      "endSeconds": 9.287981859410431,
      "label": "Bb:7"
    },
    {
      "index": 3,
      "startSeconds": 9.287981859410431,
      "endSeconds": 11.447437641723356,
      "label": "F:7"
    },
    {
      "index": 4,
      "startSeconds": 11.447437641723356,
      "endSeconds": 13.653333333333334,
      "label": "Bb:7"
    },
    {
      "index": 5,
      "startSeconds": 13.653333333333334,
      "endSeconds": 14.698231292517008,
      "label": "F:maj"
    },
    {
      "index": 6,
      "startSeconds": 14.698231292517008,
      "endSeconds": 15.882448979591837,
      "label": "A:7"
    },
    {
      "index": 7,
      "startSeconds": 15.882448979591837,
      "endSeconds": 16.904126984126986,
      "label": "D:min7"
    },
    {
      "index": 8,
      "startSeconds": 16.904126984126986,
      "endSeconds": 19.22612244897959,
      "label": "G:7"
    },
    {
      "index": 9,
      "startSeconds": 19.22612244897959,
      "endSeconds": 20.456780045351476,
      "label": "C:7"
    },
    {
      "index": 10,
      "startSeconds": 20.456780045351476,
      "endSeconds": 22.360816326530614,
      "label": "F:maj"
    },
    {
      "index": 11,
      "startSeconds": 22.360816326530614,
      "endSeconds": 23.45215419501134,
      "label": "Bb:7"
    },
    {
      "index": 12,
      "startSeconds": 23.45215419501134,
      "endSeconds": 24.56671201814059,
      "label": "F:7"
    },
    {
      "index": 13,
      "startSeconds": 24.56671201814059,
      "endSeconds": 25.58839002267574,
      "label": "Bb:7"
    },
    {
      "index": 14,
      "startSeconds": 25.58839002267574,
      "endSeconds": 26.726167800453517,
      "label": "F:7"
    },
    {
      "index": 15,
      "startSeconds": 26.726167800453517,
      "endSeconds": 27.70140589569161,
      "label": "A:7"
    },
    {
      "index": 16,
      "startSeconds": 27.70140589569161,
      "endSeconds": 28.93206349206349,
      "label": "D:min7"
    },
    {
      "index": 17,
      "startSeconds": 28.93206349206349,
      "endSeconds": 30.25560090702948,
      "label": "G:7"
    },
    {
      "index": 18,
      "startSeconds": 30.25560090702948,
      "endSeconds": 31.091519274376417,
      "label": "C:7"
    },
    {
      "index": 19,
      "startSeconds": 31.091519274376417,
      "endSeconds": 33.2974149659864,
      "label": "F:7"
    },
    {
      "index": 20,
      "startSeconds": 33.2974149659864,
      "endSeconds": 35.50331065759637,
      "label": "Bb:7"
    },
    {
      "index": 21,
      "startSeconds": 35.50331065759637,
      "endSeconds": 38.70766439909297,
      "label": "G:7"
    },
    {
      "index": 22,
      "startSeconds": 38.70766439909297,
      "endSeconds": 39.77578231292517,
      "label": "C:7"
    },
    {
      "index": 23,
      "startSeconds": 39.77578231292517,
      "endSeconds": 40.84390022675737,
      "label": "F:maj"
    },
    {
      "index": 24,
      "startSeconds": 40.84390022675737,
      "endSeconds": 42.00489795918367,
      "label": "Bb:maj"
    },
    {
      "index": 25,
      "startSeconds": 42.00489795918367,
      "endSeconds": 43.490975056689344,
      "label": "C:maj"
    },
    {
      "index": 26,
      "startSeconds": 43.490975056689344,
      "endSeconds": 46.81142857142857,
      "label": "F:maj"
    },
    {
      "index": 27,
      "startSeconds": 46.81142857142857,
      "endSeconds": 57.330068027210885,
      "label": "N"
    },
    {
      "index": 28,
      "startSeconds": 57.330068027210885,
      "endSeconds": 59.396643990929704,
      "label": "F:maj"
    },
    {
      "index": 29,
      "startSeconds": 59.396643990929704,
      "endSeconds": 61.83473922902495,
      "label": "F:min"
    },
    {
      "index": 30,
      "startSeconds": 61.83473922902495,
      "endSeconds": 67.70938775510204,
      "label": "G:maj"
    },
    {
      "index": 31,
      "startSeconds": 67.70938775510204,
      "endSeconds": 69.17224489795919,
      "label": "C:maj"
    },
    {
      "index": 32,
      "startSeconds": 69.17224489795919,
      "endSeconds": 70.49578231292517,
      "label": "F:min"
    },
    {
      "index": 33,
      "startSeconds": 70.49578231292517,
      "endSeconds": 71.8657596371882,
      "label": "C:maj"
    },
    {
      "index": 34,
      "startSeconds": 71.8657596371882,
      "endSeconds": 72.56235827664399,
      "label": "F:min"
    },
    {
      "index": 35,
      "startSeconds": 72.56235827664399,
      "endSeconds": 73.21251700680273,
      "label": "E:maj"
    },
    {
      "index": 36,
      "startSeconds": 73.21251700680273,
      "endSeconds": 76.138231292517,
      "label": "A:min"
    },
    {
      "index": 37,
      "startSeconds": 76.138231292517,
      "endSeconds": 78.69242630385487,
      "label": "F:maj"
    },
    {
      "index": 38,
      "startSeconds": 78.69242630385487,
      "endSeconds": 80.1320634920635,
      "label": "E:min7"
    },
    {
      "index": 39,
      "startSeconds": 80.1320634920635,
      "endSeconds": 81.478820861678,
      "label": "A:min7"
    },
    {
      "index": 40,
      "startSeconds": 81.478820861678,
      "endSeconds": 83.01133786848072,
      "label": "D:min7"
    },
    {
      "index": 41,
      "startSeconds": 83.01133786848072,
      "endSeconds": 84.24199546485261,
      "label": "G:7"
    },
    {
      "index": 42,
      "startSeconds": 84.24199546485261,
      "endSeconds": 87.23736961451247,
      "label": "C:maj7"
    },
    {
      "index": 43,
      "startSeconds": 87.23736961451247,
      "endSeconds": 89.79156462585034,
      "label": "G:maj"
    },
    {
      "index": 44,
      "startSeconds": 89.79156462585034,
      "endSeconds": 91.16154195011337,
      "label": "C:maj"
    },
    {
      "index": 45,
      "startSeconds": 91.16154195011337,
      "endSeconds": 92.601179138322,
      "label": "F:min/5"
    },
    {
      "index": 46,
      "startSeconds": 92.601179138322,
      "endSeconds": 94.13369614512472,
      "label": "C:maj"
    },
    {
      "index": 47,
      "startSeconds": 94.13369614512472,
      "endSeconds": 95.24825396825398,
      "label": "G:maj/3"
    },
    {
      "index": 48,
      "startSeconds": 95.24825396825398,
      "endSeconds": 98.38294784580499,
      "label": "A:min"
    },
    {
      "index": 49,
      "startSeconds": 98.38294784580499,
      "endSeconds": 99.45106575963719,
      "label": "F#:hdim7"
    },
    {
      "index": 50,
      "startSeconds": 99.45106575963719,
      "endSeconds": 100.7978231292517,
      "label": "B:7"
    },
    {
      "index": 51,
      "startSeconds": 100.7978231292517,
      "endSeconds": 102.14458049886622,
      "label": "E:min7"
    },
    {
      "index": 52,
      "startSeconds": 102.14458049886622,
      "endSeconds": 103.63065759637189,
      "label": "A:7"
    },
    {
      "index": 53,
      "startSeconds": 103.63065759637189,
      "endSeconds": 104.95419501133787,
      "label": "D:min7"
    },
    {
      "index": 54,
      "startSeconds": 104.95419501133787,
      "endSeconds": 105.69723356009071,
      "label": "G:7"
    },
    {
      "index": 55,
      "startSeconds": 105.69723356009071,
      "endSeconds": 106.30095238095238,
      "label": "Ab:hdim7"
    },
    {
      "index": 56,
      "startSeconds": 106.30095238095238,
      "endSeconds": 107.78702947845805,
      "label": "A:min7"
    },
    {
      "index": 57,
      "startSeconds": 107.78702947845805,
      "endSeconds": 109.20344671201815,
      "label": "D:7"
    },
    {
      "index": 58,
      "startSeconds": 109.20344671201815,
      "endSeconds": 110.71274376417234,
      "label": "D:min7"
    },
    {
      "index": 59,
      "startSeconds": 110.71274376417234,
      "endSeconds": 112.84897959183674,
      "label": "G:7"
    },
    {
      "index": 60,
      "startSeconds": 112.84897959183674,
      "endSeconds": 118.30566893424036,
      "label": "C:maj"
    },
    {
      "index": 61,
      "startSeconds": 118.30566893424036,
      "endSeconds": 121.103673,
      "label": "N"
    }
  ]
}
