{
  "schemaVersion": "2.0.0",
  "songId": "554",
  "durationSeconds": 189.106667,
  "segments": [
    {
      "index": 0,
      "startSeconds": 0.0,
      "endSeconds": 0.7198185941043084,
      "label": "N"
    },
    {
      "index": 1,
      "startSeconds": 0.7198185941043084,
      "endSeconds": 16.602267573696146,
      "label": "Ab:maj"
    },
    {
      "index": 2,
      "startSeconds": 16.602267573696146,
      "endSeconds": 19.52798185941043,
      "label": "C:min7"
    },
    {
      "index": 3,
      "startSeconds": 19.52798185941043,
      "endSeconds": 22.38403628117914,
      "label": "F:min"
    },
    {
      "index": 4,
      "startSeconds": 22.38403628117914,
      "endSeconds": 25.21687074829932,
      "label": "C#:maj"
    },
    {
      "index": 5,
      "startSeconds": 25.21687074829932,
      "endSeconds": 25.820589569160997,
      "label": "Eb:sus4"
    },
    {
      "index": 6,
      "startSeconds": 25.820589569160997,
      "endSeconds": 28.258684807256238,
      "label": "Ab:maj"
    },
    {
      "index": 7,
      "startSeconds": 28.258684807256238,
      "endSeconds": 31.161179138321994,
      "label": "C:min7"
    },
    {
      "index": 8,
      "startSeconds": 31.161179138321994,
      "endSeconds": 34.13333333333333,
      "label": "F:min"
    },
    {
      "index": 9,
      "startSeconds": 34.13333333333333,
      "endSeconds": 35.22467120181406,
      "label": "C#:maj/3"
    },
    {
      "index": 10,
      "startSeconds": 35.22467120181406,
      "endSeconds": 36.40888888888889,
      "label": "Eb:maj"
    },
    {
      "index": 11,
      "startSeconds": 36.40888888888889,
      "endSeconds": 37.964625850340134,
      "label": "Ab:maj"
    },
    {
      "index": 12,
      "startSeconds": 37.964625850340134,
      "endSeconds": 45.7665306122449,
      "label": "N"
    },
    {
      "index": 13,
      "startSeconds": 45.7665306122449,
      "endSeconds": 51.50185941043084,
      "label": "Ab:maj"
    },
    {
      "index": 14,
      "startSeconds": 51.50185941043084,
      "endSeconds": 54.381133786848075,
      "label": "C:min7"
    },
    {
      "index": 15,
      "startSeconds": 54.381133786848075,
      "endSeconds": 57.283628117913835,
      "label": "F:min"
    },
    {
      "index": 16,
      "startSeconds": 57.283628117913835,
      "endSeconds": 60.162902494331064,
      "label": "C#:maj"
    },
    {
      "index": 17,
      "startSeconds": 60.162902494331064,
      "endSeconds": 63.15827664399093,
      "label": "Ab:maj"
    },
    {
      "index": 18,
      "startSeconds": 63.15827664399093,
      "endSeconds": 66.01433106575963,
      "label": "C:min"
    },
    {
      "index": 19,
      "startSeconds": 66.01433106575963,
      "endSeconds": 68.9168253968254,
      "label": "F:min"
    },
    {
      "index": 20,
      "startSeconds": 68.9168253968254,
      "endSeconds": 71.79609977324263,
      "label": "C#:maj"
    },
    {
      "index": 21,
      "startSeconds": 71.79609977324263,
      "endSeconds": 77.71718820861678,
      "label": "Ab:maj"
    },
    {
      "index": 22,
      "startSeconds": 77.71718820861678,
      "endSeconds": 80.71256235827664,
      "label": "C:min7"
    },
    {
      "index": 23,
      "startSeconds": 80.71256235827664,
      "endSeconds": 83.49895691609977,
      "label": "F:min"
    },
    {
      "index": 24,
      "startSeconds": 83.49895691609977,
      "endSeconds": 85.8441723356009,
      "label": "C#:maj"
    },
    {
      "index": 25,
      "startSeconds": 85.8441723356009,
      "endSeconds": 89.35038548752834,
      "label": "Ab:maj"
    },
    {
      "index": 26,
      "startSeconds": 89.35038548752834,
      "endSeconds": 92.25287981859411,
      "label": "C:min7"
    },
    {
      "index": 27,
      "startSeconds": 92.25287981859411,
      "endSeconds": 95.15537414965986,
      "label": "F:min"
    },
    {
      "index": 28,
      "startSeconds": 95.15537414965986,
      "endSeconds": 96.01451247165534,
      "label": "C#:maj"
    },
    {
      "index": 29,
      "startSeconds": 96.01451247165534,
      "endSeconds": 96.75755102040817,
      "label": "C#:maj/2"
    },
    {
      "index": 30,
      "startSeconds": 96.75755102040817,
      "endSeconds": 99.07954648526078,
      "label": "Ab:maj"
    },
    {
      "index": 31,
      "startSeconds": 99.07954648526078,
      "endSeconds": 106.88145124716553,
      "label": "N"
    },
    {
      "index": 32,
      "startSeconds": 106.88145124716553,
      "endSeconds": 112.68643990929705,
      "label": "Ab:maj"
    },
    {
      "index": 33,
      "startSeconds": 112.68643990929705,
      "endSeconds": 115.4960544217687,
      "label": "C:min7"
    },
    {
      "index": 34,
      "startSeconds": 115.4960544217687,
      "endSeconds": 118.39854875283447,
      "label": "F:min"
    },
    {
      "index": 35,
      "startSeconds": 118.39854875283447,
      "endSeconds": 120.44190476190477,
      "label": "C#:maj"
    },
    {
      "index": 36,
      "startSeconds": 120.44190476190477,
      "endSeconds": 121.32426303854875,
      "label": "Eb:maj"
    },
    {
      "index": 37,
      "startSeconds": 121.32426303854875,
      "endSeconds": 124.22675736961452,
      "label": "Ab:maj"
    },
    {
      "index": 38,
      "startSeconds": 124.22675736961452,
      "endSeconds": 127.08281179138322,
      "label": "C:min7"
    },
    {
      "index": 39,
      "startSeconds": 127.08281179138322,
      "endSeconds": 130.0085260770975,
      "label": "F:min"
    },
    {
      "index": 40,
      "startSeconds": 130.0085260770975,
      "endSeconds": 132.9342403628118,
      "label": "C#:maj"
    },
    {
      "index": 41,
      "startSeconds": 132.9342403628118,
      "endSeconds": 153.39102040816326,
      "label": "Ab:maj"
    },
    {
      "index": 42,
      "startSeconds": 153.39102040816326,
      "endSeconds": 156.1774149659864,
      "label": "C:min7"
    },
    {
      "index": 43,
      "startSeconds": 156.1774149659864,
      "endSeconds": 159.1263492063492,
      "label": "F:min"
    },
    {
      "index": 44,
      "startSeconds": 159.1263492063492,
      "endSeconds": 161.93596371882086,
      "label": "C#:maj"
    },
    {
      "index": 45,
      "startSeconds": 161.93596371882086,
      "endSeconds": 164.95455782312925,
      "label": "Ab:maj"
    },
    {
      "index": 46,
      "startSeconds": 164.95455782312925,
      "endSeconds": 167.8338321995465,
      "label": "C:min"
    },
    {
      "index": 47,
      "startSeconds": 167.8338321995465,
      "endSeconds": 170.73632653061225,
      "label": "F:min"
    },
    {
      "index": 48,
      "startSeconds": 170.73632653061225,
      "endSeconds": 173.6156009070295,
      "label": "C#:maj"
    },
    {
      "index": 49,
      "startSeconds": 173.6156009070295,
      "endSeconds": 177.4701133786848,
      "label": "Ab:maj"
    },
    {
      "index": 50,
      "startSeconds": 177.4701133786848,
      "endSeconds": 182.4391836734694,
      "label": "N"
    },
    {
      "index": 51,
      "startSeconds": 182.4391836734694,
      "endSeconds": 184.73795918367347,
      "label": "Ab:maj"
    },
    {
      "index": 52,
      "startSeconds": 184.73795918367347,
      "endSeconds": 189.106667,
      "label": "N"
    }
  ]
}
