{
  "schemaVersion": "2.0.0",
  "songId": "527",
  "durationSeconds": 99.030204,
  "segments": [
    {
      "index": 0,
      "startSeconds": 0.0,
      "endSeconds": 3.3436734693877552,
      "label": "N"
    },
    {
      "index": 1,
      "startSeconds": 3.3436734693877552,
      "endSeconds": 4.9458503401360545,
      "label": "D:min"
    },
    {
      "index": 2,
      "startSeconds": 4.9458503401360545,
      "endSeconds": 6.431927437641724,
      "label": "E:min7"
    },
    {
      "index": 3,
      "startSeconds": 6.431927437641724,
      "endSeconds": 7.801904761904762,
      "label": "F:maj"
    },
    {
      "index": 4,
      "startSeconds": 7.801904761904762,
      "endSeconds": 9.58984126984127,
      "label": "E:min7"
    },
    {
      "index": 5,
      "startSeconds": 9.58984126984127,
      "endSeconds": 10.820498866213152,
      "label": "D:min7"
    },
    {
      "index": 6,
      "startSeconds": 10.820498866213152,
      "endSeconds": 12.30657596371882,
      "label": "E:min7"
    },
    {
      "index": 7,
      "startSeconds": 12.30657596371882,
      "endSeconds": 13.630113378684808,
      "label": "F:maj7"
    },
    {
      "index": 8,
      "startSeconds": 13.630113378684808,
      "endSeconds": 14.373151927437641,
      "label": "E:min"
    },
    {
      "index": 9,
      "startSeconds": 14.373151927437641,
      "endSeconds": 15.046530612244899,
      "label": "G:maj/3"
    },
    {
      "index": 10,
      "startSeconds": 15.046530612244899,
      "endSeconds": 18.11156462585034,
      "label": "Bb:maj7"
    },
    {
      "index": 11,
      "startSeconds": 18.11156462585034,
      "endSeconds": 21.037278911564627,
      "label": "A:min7"
    },
    {
      "index": 12,
      "startSeconds": 21.037278911564627,
      "endSeconds": 22.825215419501134,
      "label": "D:min7"
    },
    {
      "index": 13,
      "startSeconds": 22.825215419501134,
      "endSeconds": 24.241632653061224,
      "label": "E:min7"
    },
    {
      "index": 14,
      "startSeconds": 24.241632653061224,
      "endSeconds": 25.611609977324264,
      "label": "F:maj7"
    },
    {
      "index": 15,
      "startSeconds": 25.611609977324264,
      "endSeconds": 26.865487528344673,
      "label": "E:min"
    },
    {
      "index": 16,
      "startSeconds": 26.865487528344673,
      "endSeconds": 29.76798185941043,
      "label": "Bb:maj7"
    },
    {
      "index": 17,
      "startSeconds": 29.76798185941043,
      "endSeconds": 32.71691609977324,
      "label": "A:min7"
    },
    {
      "index": 18,
      "startSeconds": 32.71691609977324,
      "endSeconds": 35.5265306122449,
      "label": "F:maj7"
    },
    {
      "index": 19,
      "startSeconds": 35.5265306122449,
      "endSeconds": 37.1287074829932,
      "label": "E:min7"
    },
    {
      "index": 20,
      "startSeconds": 37.1287074829932,
      "endSeconds": 38.47546485260771,
      "label": "A:min7"
    },
    {
      "index": 21,
      "startSeconds": 38.47546485260771,
      "endSeconds": 39.9847619047619,
      "label": "Bb:maj"
    },
    {
      "index": 22,
      "startSeconds": 39.9847619047619,
      "endSeconds": 41.40117913832199,
      "label": "Eb:maj"
    },
    {
      "index": 23,
      "startSeconds": 41.40117913832199,
      "endSeconds": 42.887256235827664,
      "label": "Ab:maj7"
    },
    {
      "index": 24,
      "startSeconds": 42.887256235827664,
      "endSeconds": 44.419773242630384,
      "label": "G:maj"
    },
    {
      "index": 25,
      "startSeconds": 44.419773242630384,
      "endSeconds": 46.13804988662132,
      "label": "C:maj"
    },
    {
      "index": 26,
      "startSeconds": 46.13804988662132,
      "endSeconds": 47.206167800453514,
      "label": "F:min/5"
    },
    {
      "index": 27,
      "startSeconds": 47.206167800453514,
      "endSeconds": 49.55138321995465,
      "label": "C:maj"
    },
    {
      "index": 28,
      "startSeconds": 49.55138321995465,
      "endSeconds": 50.15510204081633,
      "label": "G:maj/3"
    },
    {
      "index": 29,
      "startSeconds": 50.15510204081633,
      "endSeconds": 51.66439909297052,
      "label": "A:min7"
    },
    {
      "index": 30,
      "startSeconds": 51.66439909297052,
      "endSeconds": 53.080816326530616,
      "label": "C:maj/5"
    },
    {
      "index": 31,
      "startSeconds": 53.080816326530616,
      "endSeconds": 54.89197278911565,
      "label": "F:maj7"
    },
    {
      "index": 32,
      "startSeconds": 54.89197278911565,
      "endSeconds": 56.076190476190476,
      "label": "G:maj/b7"
    },
    {
      "index": 33,
      "startSeconds": 56.076190476190476,
      "endSeconds": 57.53904761904762,
      "label": "E:min7"
    },
    {
      "index": 34,
      "startSeconds": 57.53904761904762,
      "endSeconds": 59.025124716553286,
      "label": "A:min7"
    },
    {
      "index": 35,
      "startSeconds": 59.025124716553286,
      "endSeconds": 60.60408163265306,
      "label": "B:hdim7"
    },
    {
      "index": 36,
      "startSeconds": 60.60408163265306,
      "endSeconds": 61.90439909297052,
      "label": "E:7"
    },
    {
      "index": 37,
      "startSeconds": 61.90439909297052,
      "endSeconds": 62.69387755102041,
      "label": "A:min7"
    },
    {
      "index": 38,
      "startSeconds": 62.69387755102041,
      "endSeconds": 64.87655328798186,
      "label": "C:7"
    },
    {
      "index": 39,
      "startSeconds": 64.87655328798186,
      "endSeconds": 67.73260770975057,
      "label": "F:maj7"
    },
    {
      "index": 40,
      "startSeconds": 67.73260770975057,
      "endSeconds": 69.26512471655329,
      "label": "E:min7"
    },
    {
      "index": 41,
      "startSeconds": 69.26512471655329,
      "endSeconds": 70.70476190476191,
      "label": "A:min7"
    },
    {
      "index": 42,
      "startSeconds": 70.70476190476191,
      "endSeconds": 72.09795918367347,
      "label": "D:min7"
    },
    {
      "index": 43,
      "startSeconds": 72.09795918367347,
      "endSeconds": 73.70013605442178,
      "label": "G:7"
    },
    {
      "index": 44,
      "startSeconds": 73.70013605442178,
      "endSeconds": 75.81315192743764,
      "label": "C:7"
    },
    {
      "index": 45,
      "startSeconds": 75.81315192743764,
      "endSeconds": 76.55619047619048,
      "label": "C:maj/3"
    },
    {
      "index": 46,
      "startSeconds": 76.55619047619048,
      "endSeconds": 79.48190476190476,
      "label": "F:maj7"
    },
    {
      "index": 47,
      "startSeconds": 79.48190476190476,
      "endSeconds": 80.96798185941043,
      "label": "E:min7"
    },
    {
      "index": 48,
      "startSeconds": 80.96798185941043,
      "endSeconds": 82.50049886621315,
      "label": "A:min7"
    },
    {
      "index": 49,
      "startSeconds": 82.50049886621315,
      "endSeconds": 84.00979591836735,
      "label": "Bb:maj"
    },
    {
      "index": 50,
      "startSeconds": 84.00979591836735,
      "endSeconds": 85.40299319727892,
      "label": "A:min7"
    },
    {
      "index": 51,
      "startSeconds": 85.40299319727892,
      "endSeconds": 87.00517006802721,
      "label": "Eb:maj7"
    },
    {
      "index": 52,
      "startSeconds": 87.00517006802721,
      "endSeconds": 88.88598639455782,
      "label": "Ab:maj7"
    },
    {
      "index": 53,
      "startSeconds": 88.88598639455782,
      "endSeconds": 95.41079365079365,
      "label": "G:maj"
    },
    {
      "index": 54,
      "startSeconds": 95.41079365079365,
      "endSeconds": 99.030204,
      "label": "N"
    }
  ]
}
